iteration	commit	metric	cagr	max_drawdown	status	description
0	3cfe57a	0.6515	0.1651	-0.2606	baseline	XGBoost regressor top-10, equal-weight, monthly rebalance, 3y train window, 10bps cost
1	dabef48	0.6578	0.1569	-0.2461	keep	switch position sizing from equal-weight to inverse-volatility
2	-	0.5536	0.1383	-0.3583	discard	tried HRP weighting (underperforms on small N=10 basket, likely overfits noisy clustering)
3	-	0.2722	0.0313	-0.2509	discard	tried vol-targeting overlay (target 15%): cuts vol as intended but crushes CAGR/Sharpe - reactive vol-scaling levers up right before crashes (matches literature caveat on real-time vol-mgmt performance)
4	-	0.6016	0.1584	-0.3579	discard	tried rank_objective=True (XGBRanker cross-sectional rank instead of point regression) - found as an uncommitted local diff, verified properly: worse Sharpe and much deeper drawdown than kept baseline
5	122d847	1.1126	0.3498	-0.2396	keep	extended forward-return label horizon from 21 to 42 trading days (~2 months) - smoother cross-sectional ranking signal, also improved max drawdown
6	-	0.8341	0.2610	-0.3234	discard	tried train_window_years=5 combined with the new label_horizon=42 baseline - worse than label_horizon=42 alone (interaction effect: longer training window does not stack with the smoother label)
7	-	0.9835	0.2816	-0.2306	discard	tried top_n=15 combined with the label_horizon=42 baseline - worse than label_horizon=42 alone (again does not stack additively)
8	-	0.2817	0.0321	-0.2329	discard	retried vol-targeting overlay with faster lookback=21 and delever-only max_leverage=1.0 (vs iter-3's 63/1.5) - still crushes CAGR/Sharpe, delever-only doesn't fix the core issue of cutting exposure during profitable-but-volatile periods
9	-	0.4826	0.0885	-0.2716	discard	tried market-regime de-risking filter (halve exposure when equal-weighted universe proxy is below its 200d SMA) - noisy proxy causes whipsaws, hurt Sharpe/CAGR and even worsened max drawdown
10	-	0.6578	0.1569	-0.2461	discard	tried averaging 3 XGBoost regressors (seeds 0/1/2) - identical to single-model baseline since no subsample/colsample stochasticity is configured, random_state has no effect; added complexity for zero gain
11	-	-999.0	-	-	crash	tried swapping XGBoost for LightGBM (LGBMRegressor) in the non-ranking path - regression_check.py crashed with an access-violation inside LightGBM's native code; reproduced with a minimal standalone fit() outside project code, so this conda env's lightgbm 4.7.0 install itself is broken (not a logic bug) - needs a reinstall (e.g. force-reinstall or conda-forge build) before retrying
12	-	-999.0	-	-	discard-regression	tried swapping XGBoost for an sklearn MLPRegressor (+StandardScaler) in the non-ranking path - regression suite dropped to 7/10 passed: MLPRegressor cannot handle the NaN feature values that XGBoost tolerates natively (e.g. return_2y undefined in short windows), silently zeroing out every month in the tiny backtest - would need an imputer added to be a fair test, not attempted here
13	-	0.6348	0.1503	-0.2768	discard	tried turnover hysteresis (keep a held name unless its rank falls outside top_n+5) - Sharpe, CAGR, and max drawdown all slightly worse than baseline; didn't reduce turnover as hoped either (1.6447 vs baseline ~1.74, marginal)
14	-	0.4725	0.0982	-0.3248	discard	tried new price-only feature pth_52wk (52-week-high proximity, George & Hwang 2004 anomaly, literature-grounded) added to engineer_features - hurt Sharpe/CAGR/MaxDD noticeably in this universe/period despite academic support elsewhere
15	3052a4b	1.0904	0.3406	-0.2427	keep	realistic cost model (correctness fix, not an alpha experiment): spread_bps=7.5 + 1EUR flat fee/order @ 10k EUR compounding capital, replacing the pure 10bps-of-turnover assumption. Effect on the label_horizon=42 baseline is small (Sharpe 1.1126->1.0904) because capital compounds fast; on the slower old label_horizon=21 config the same fee model costs more (Sharpe 0.6578->0.6150 measured off-baseline) since the fixed fee stays relatively larger for longer
16	-	0.9665	0.2821	-0.3774	discard	swept label_horizon_days=35 against the cost-realistic label_horizon=42 baseline - worse Sharpe and notably worse max drawdown (-37.7%)
17	-	0.9802	0.3050	-0.2752	discard	swept label_horizon_days=50 against the cost-realistic label_horizon=42 baseline - worse Sharpe and MaxDD; both 35 and 50 underperform 42, confirming it as a local optimum at this sweep resolution
18	d836fad	1.2129	0.4809	-0.3263	keep	concentrated basket from top_n=10 to top_n=5 - clear Sharpe/CAGR win but MaxDD deepened substantially (-24.3%->-32.6%) and annual_vol rose to 38.5% - flagged to user as a real risk-tolerance tradeoff, not a free lunch
19	-	1.1986	0.4758	-0.3049	discard	re-tried turnover hysteresis (buffer=2) combined with the new top_n=5 baseline - worse Sharpe than top_n=5 alone (1.2129), though MaxDD (-30.5%) and turnover (1.60) both improved slightly - a real risk/return tradeoff but Sharpe is the tracked objective and it is lower
20	-	1.1065	0.3473	-0.2416	sensitivity	cost-assumption sensitivity check (not adopted): spread_bps=5.0 instead of 7.5 vs the pre-top_n=5 baseline - confirms result is not overly sensitive to the exact spread estimate, did not change the actual config
21	-	1.0743	0.3339	-0.2438	sensitivity	cost-assumption sensitivity check (not adopted): spread_bps=10.0 instead of 7.5 vs the pre-top_n=5 baseline - modest expected degradation, did not change the actual config
22	-	1.1097	0.3486	-0.2406	sensitivity	cost-assumption sensitivity check (not adopted): flat_fee_per_trade_eur=0.5 instead of 1.0 vs the pre-top_n=5 baseline - did not change the actual config, real fee is a broker fact not a tuning knob
23	-	1.0496	0.3238	-0.2470	sensitivity	cost-assumption sensitivity check (not adopted): flat_fee_per_trade_eur=2.0 instead of 1.0 vs the pre-top_n=5 baseline - confirms strategy stays Sharpe>1 even at 2x the assumed fee, did not change the actual config
24	-	1.0829	0.3377	-0.2429	discard	added min_trade_weight_delta=0.01 threshold to skip re-trading sub-1pp weight drift - essentially a no-op/marginal regression on this dataset, the flat EUR1 fee is already small enough that this doesn't help
25	-	0.9381	0.2366	-0.2913	discard	tried top_n=20 against the label_horizon=42 baseline - worse on every metric, dilutes the model's highest-conviction picks
26	-	0.9459	0.2648	-0.2672	discard	tried train_window_years=2 against the label_horizon=42 baseline - worse on every metric; both directions (2 and 5) now fail against this baseline, 3 remains best
27	-	0.5168	0.0773	-0.2214	discard	tried combining HRP weighting with the vol-targeting overlay (both at their original individually-failed defaults) - the two failure modes stack rather than cancel, now underperforms even buy&hold
28	-	1.0004	0.2918	-0.2537	discard	added MAX-effect feature (max daily return, trailing 21 days; Bali/Cakici/Whitelaw 2011) - hurt performance despite academic backing, second literature factor in a row to fail on this specific universe/period
29	-	1.0255	0.3178	-0.2555	discard	added idiosyncratic-volatility feature (63d rolling beta vs equal-weighted universe proxy; Ang/Hodrick/Xing/Zhang 2006) - hurt performance, confirms the MAX-effect finding that this factor family doesn't transfer well here
30	-	-0.8610	-1.0000	-1.0292	discard	tried continuous rank-weighted long-only book (tilt whole universe, ~150-250 names/month) instead of top-N - catastrophic: wiped out capital. Root cause: holding ~25x more names means ~25x more flat EUR1 fees/month, which compounds destructively at this account size - a real cost-model interaction, not a bug in the weighting logic
31	-	0.7181	0.2156	-0.3316	discard	swapped XGBoost for a linear ElasticNet (+imputer+scaler) as a model-family sanity check - notably worse, confirms XGBoost's nonlinear/interaction modeling adds real value over a linear factor model on these features
32	-	1.0615	0.3763	-0.3824	discard	enabled Amihud illiquidity (63d) + relative volume spike features (first ever volume-based features, backfilled via scripts/backfill_volume.py) - worse Sharpe and notably worse MaxDD (-38.2%) vs the top_n=5 baseline. Fourth factor-mining attempt in a row to fail (after pth_52wk, MAX effect, idiosyncratic vol) - this specific small-basket/cost-aware setup seems to resist added cross-sectional factors generally, not just price-only ones
33	-	1.1455	0.4026	-0.3223	discard	isolated test: Amihud illiquidity feature alone (without volume_spike) - still worse than top_n=5 baseline (1.1455 vs 1.2129)
34	-	1.2184	0.4647	-0.3462	discard	isolated test: volume_spike feature alone (without illiq_amihud) - Sharpe barely better (+0.0055, within noise), but CAGR lower and MaxDD worse than baseline; not worth the added data-pipeline complexity (volume backfill + ongoing maintenance) for a marginal, non-robust gain
35	ede6be3	1.5590	0.7071	-0.2607	keep	switched rebalance_freq from monthly to weekly (label_horizon_days scaled to 10 = ~2 weeks) - clear Sharpe/CAGR win, MaxDD also improved, 342 periods (much more statistically robust than the 79-month baseline)
36	-	-999.0	-	-	discard-regression	tried rebalance_freq=Q with label_horizon_days=126 - regression_check.py failed "tiny backtest produced some months": the synthetic test only overrides start_year/end_year/train_window_years/top_n, so it inherited the new class-level defaults (label_horizon_days=126 with a ~3.5yr synthetic series leaves no valid quarters). Absolute gate per protocol - discarded without looking at Sharpe
37	-	0.7761	0.3323	-0.2884	discard	tried rebalance_freq=Q (label_horizon_days=126, ~2 quarters forward) against the weekly baseline - much worse Sharpe (0.78 vs 1.56), only 27 periods (far less statistically robust than weeklys 342)
38	-	1.0612	0.3617	-0.2985	discard	tried rebalance_freq=Y (label_horizon_days=252, ~1yr forward) against the weekly baseline - much worse Sharpe (1.06 vs 1.56), and only 6 yearly periods over 2018-2026 - statistically close to meaningless (n=6), consistent with the earlier caution that yearly rebalancing cant be evaluated with any real confidence on this backtest window
39	-	-0.4773	-1.0000	-1.0003	discard	tried rebalance_freq=D (label_horizon_days=2, ~2 trading days forward) against the weekly baseline - catastrophic: wiped out capital (Sharpe -0.48, CAGR -100%), same root cause as iteration 30's rank-weighted-book failure: 1659 daily periods vs weekly's 342 means ~5x more flat EUR1 per-trade fees compounding on the same 10k EUR account, on top of a much noisier 2-day-forward label giving the model far less real signal to trade on. Also took 5385s (~90min) vs weekly's 374s to compute since the walk-forward loop retrains XGBoost fresh on every single trading day - this backtest architecture does not scale to daily frequency without engineering changes (e.g. periodic-only refits) even before considering whether the result would be any good. Resolves Tier 0's last open item: more-frequent-than-weekly rebalancing is now a closed line of inquiry for this account size/cost model.
40	-	1.4797	0.5720	-0.2784	discard	swept label_horizon_days=15 (vs weekly baseline's 10) - worse Sharpe (1.48 vs 1.56) and CAGR, MaxDD also slightly deeper - the 2x-holding-period ratio carried over from monthly (42/21) already sits at its analog for weekly (10/5), this confirms 10 rather than assuming it
41	-	-0.5230	-0.2135	-0.8306	discard	swept label_horizon_days=5 (=1x holding period, vs weekly baseline's 10) - much worse Sharpe (-0.52) and MaxDD (-83%), consistent with the shorter-label=noisier-signal pattern that also broke daily rebalancing in iteration 39. Brackets iteration 40's result: 10 is confirmed as a real local optimum on this axis (15 and 5 both underperform), not just an untested assumption
42	-	1.5035	0.7714	-0.3519	discard	tried top_n=3 (further concentration vs weekly baseline's top_n=5) - Sharpe slightly worse (1.50 vs 1.56) despite higher CAGR (77% vs 71%): MaxDD deepened to -35.2% and annual_vol rose to 44.5%, same pattern as the top_n=10->5 tradeoff but the risk cost now outweighs the Sharpe benefit at this concentration - 5 remains the local optimum on basket size
43	-	1.1292	0.4038	-0.2689	discard	first fair CatBoost test (pip installed catboost 1.2.10, added model_family config knob, CatBoostRegressor with same n_estimators/max_depth/learning_rate as XGBoost) - clearly worse Sharpe (1.13 vs 1.56 XGBoost baseline) and slower (592s vs 374s). CatBoost's default feature handling/regularization doesn't suit this small cross-sectional dataset as well as XGBoost's - closes the "CatBoost not fairly tested" item from Tier 6
44	-	1.3347	0.5312	-0.2783	discard	implemented purged walk-forward CV (embargoed 80/20 train/val split per period's training window, picks model_max_depth from {3,5,7} by cross-sectional Spearman IC) instead of the fixed max_depth=5 - worse Sharpe (1.33 vs 1.56) and 3.2x slower (1197s vs 374s). The per-period validation slice (~20% of a 3yr window, further shrunk by the label-horizon embargo) is likely too short/noisy to reliably pick a better depth than just using a fixed, already-reasonable default - a more textbook implementation (proper k-fold, larger grid) might behave differently but at proportionally higher cost, and the direction of this result doesn't obviously justify that added complexity
45	25afd5b	1.7157	0.7590	-0.2742	keep	retested train_window_years=3->2 against the current weekly+top_n=5+cost-model baseline - clear win (Sharpe 1.56->1.72, CAGR 71%->76%), also faster (264s vs 374s). Previously discarded (iteration 26) but that was only ever tested against the old monthly label_horizon=42 baseline - a shorter, more-recent-data training window interacts positively with the newer weekly-rebalance/tighter-basket stack even though it lost standalone against the older config. New best-Sharpe baseline going forward.
46	3b37535	1.8606	0.7911	-0.3131	keep	following up in the same direction: train_window_years=2->1 - another clear win (Sharpe 1.72->1.86, CAGR 79%), also faster (222s vs 264s) and lower annual_vol (34.6% vs 36.9%), though MaxDD deepened a bit (-31.3% vs -27.4%). Monotonic improvement across 3 data points (3yr->2yr->1yr) suggests this momentum strategy's signal decays fast and a shorter, more-recent training window tracks current regime dynamics better than a longer one; ~126k training rows/period even at 1yr (500-ticker universe x ~252 trading days) is still far above any small-sample overfitting concern. New best-Sharpe baseline.
47	c16a156	2.3967	1.1478	-0.2300	keep	pushed further: train_window_years=1->0.5 (6 months) - required switching backtest.py's DateOffset from years to months internally (also fixed paper_trading/engine.py's identical call so the live bot stays consistent). Sharpe jumped again to 2.40 (CAGR 114.8%/yr, MaxDD even improved to -23.0%). Mechanically this is another clear win and technically kept, BUT this is the 4th consecutive monotonic jump from shrinking this one axis (3yr:1.56 -> 2yr:1.72 -> 1yr:1.86 -> 0.5yr:2.40) and a sustained 115%/yr CAGR is an extraordinary claim for a real anomaly - this pattern (metric exploding as a window shrinks toward zero, on a backtest window that has now been reused across 9 experiments in this session alone) is the textbook signature of backtest overfitting to a fixed evaluation period, not necessarily real alpha. STOPPING this specific axis here deliberately - do not test 3-month/1-month windows next, that would just be chasing the fixed-test-set curve further. Flagged prominently to the user; paper_trading's live forward-test result is now more important than ever to check before trusting this.
48	a030f81	1.8606	0.7911	-0.3131	discard-live	live-evidence rollback: train_window_years=0.5->1.0, undoing iteration 47. paper_trading's live forward test (2026-07-24 to 2026-08-28, 26 trading days / 6 rebalances, entirely under the 0.5yr config) came back decisively negative: bot -15.1% cumulative vs benchmark +4.5% cumulative (~19.5pp gap, no recovery, monotonic bleed across nearly every rebalance). This is the exact overfitting failure mode flagged in iteration 47's own log entry - a backtest Sharpe of 2.40/CAGR 115% that evaporated (went strongly negative) on genuinely new out-of-sample data the config was never fit against. Metric/cagr/max_drawdown columns here are iteration 46's already-established backtest numbers for train_window_years=1.0 (re-running would reproduce them exactly - XGBoost's random_state has no effect per iteration 10), not a fresh benchmark.py run. paper_trading state/nav_log left untouched (no reset) since only the training-window lookback changed, not rebalance_freq/label_horizon_days - future rebalances pick up the reverted config going forward, and the bad 5 weeks stay in the record as the evidence that triggered this rollback.
49	acc1fa5	1.5549	0.6063	-0.3131	harness	locked-holdout split (see benchmark-harness.md): DEFAULT_CONFIG.end_year 2026->2023, so all future iterations only ever see 2018-2023 (root cause of the iteration-47 overfit was reusing the full 2018-2026 window across ~10 experiments in one session). 2024-2026 is now a locked holdout, checked via the new holdout_check.py, never fed into keep/discard decisions. metric/cagr/max_drawdown here are a FRESH benchmark.py run of the current config (train_window_years=1.0, everything else unchanged since iteration 48) against the new 2018-2023 research window - NOT comparable to any iteration 0-48 number, all of which were measured on the old 2018-2026 window. **This row's Sharpe 1.5549 is the new sharpe_prev_kept reference for iteration 50 onward, replacing iteration 48's 1.8606.** For the record, the same config's holdout_check.py reading (2024-2026, informational only, not a decision input): Sharpe 2.7465, CAGR 147%, vs. buy&hold Sharpe 1.3418/CAGR 15.8% for the same holdout period - the holdout period was evidently a much stronger bull market overall (buy&hold Sharpe more than 2x the research window's 0.5930), so the strategy's edge-over-benchmark ratio held up (~2.6x research, ~2.0x holdout) but the absolute holdout Sharpe should not be read as "the bot will now perform like this" - it's still backtested history (never live), covers a different, shorter, favorable-regime window, and long-only equity strategies are the last thing that should be judged from a bull-market slice.
50	-	-999.0	-	-	crash	tried model_family=mlp (sklearn MLPRegressor + median-imputer + StandardScaler pipeline, first fair test with NaN handling after iteration 12's discard-regression) against the new 2018-2023 research baseline - regression gate passed (14/14) but benchmark.py exceeded 10 minutes (>4x the ~159s XGBoost baseline on this window) with no result and was killed, per the harness's timeout-as-crash rule. Retraining an MLP from scratch every single weekly period (260 periods) is simply far more expensive than XGBoost's tree fits at this data size - mechanically impractical at this rebalance cadence regardless of what its Sharpe might have been, same conclusion as CatBoost's slowdown (iteration 43) but worse. Not retried with fewer max_iter/smaller network in this session; would need a materially cheaper MLP config (e.g. single hidden layer, max_iter<=100, or fit-once-reuse-across-periods) to even be timeable, and there's no evidence yet it's worth that engineering effort.
51	57799a1	1.7256	0.7226	-0.2616	keep	enabled XGBoost row/feature subsampling (subsample=0.8, colsample_bytree=0.8, fixed random_state=0 for reproducibility) against the 2018-2023 research baseline - every prior XGBoost config in this project had subsample=colsample_bytree=1.0 (deterministic, full-data trees every round), which is also why iteration 10's seed-ensemble was a no-op (identical trees regardless of random_state). Clear win: Sharpe 1.5549->1.7256 (research window), MaxDD also improved -31.3%->-26.2%, CAGR 60.6%->72.3%. Thematically this is a genuine anti-overfitting mechanism (each tree sees a random 80% of rows/columns, reducing variance) rather than a "fit the fixed backtest window harder" lever like iteration 47's train_window shrink - more grounds for optimism that this generalizes, but per the harness's own new rule this still hasn't been checked against the 2024-2026 holdout yet, and paper_trading's live result remains the real test regardless.
-	-	-	-	-	holdout-check	sparing holdout_check.py run on iteration 51's kept config (per the "before trusting a big keep" rule): Sharpe 2.7465->2.9594 on 2024-2026, improving in the SAME direction as the research-window result (1.5549->1.7256). This is a meaningfully better signal than iteration 47's train_window shrink ever had - that one only ever looked good on the window it was tuned against; this one improves on two disjoint windows (2018-2023 tuned-against, 2024-2026 never touched) from the same underlying mechanism (real per-tree regularization, not squeezing more fit out of one fixed period). Still not live evidence - paper_trading (currently running with this config from its next rebalance onward) remains the actual test.
52	-	1.7245	0.7243	-0.2710	discard	tried model_n_seeds=3 (average predictions across 3 random_state seeds, now meaningful since iteration 51's subsample/colsample_bytree gives each seed real variance) against the iteration-51 baseline (Sharpe 1.7256) - essentially flat (1.7245, -0.0011) but 2.6x slower (437s vs 171s) since it fits 3x as many models per period. Confirms iteration 51's single-model regularization had already captured the available variance-reduction benefit at this data size/basket size - averaging 3 already-regularized trees on top adds cost without adding signal. Not worth it; reverted to model_n_seeds=1.
