iteration	commit	metric	cagr	max_drawdown	status	description
53	c95c41a	2.1347	0.9846	-0.2930	keep	retested model_max_depth=5->7 now that subsample/colsample_bytree regularization exists (iteration 44's earlier depth-vs-CV sweep predates any regularization, so wasn't a fair test of deeper trees under this setup). Big jump vs iteration-51 baseline: Sharpe 1.7256->2.1347 (research window), CAGR 72.3%->98.5%, MaxDD slightly deeper (-26.2%->-29.3%). Meets the keep threshold clearly. CAUTION flagged before committing to trust this fully: checked against the 2024-2026 holdout per the "before trusting a big keep" rule - it ALSO improved (2.9594->3.1496) but by a much smaller relative amount (+6.4% vs research's +24%). Direction agrees on both windows (unlike iteration 47, which was never checked at all before failing live) but the size of the gain doesn't transfer proportionally, a real if mild overfitting signature - deeper trees have more capacity to fit window-specific noise even with row/column subsampling. Kept per the mechanical Sharpe-delta rule (holdout is informational, not a decision input, per the harness's own rule against tuning against it) but flagged here explicitly: don't stack further depth increases (e.g. 9, 11) on top of this without expecting the research/holdout gap to widen further, and weight this keep's live risk higher than iteration 51's when paper_trading results come in.
54	-	2.1545	0.9837	-0.2850	discard	retested turnover hysteresis (keep a held name unless its rank falls outside top_n+2) against the current regularized/depth=7 baseline (Sharpe 2.1347) - third time this idea has been tried (iterations 13, 19), still doesn't clear the bar: Sharpe 2.1545 is only +0.0198, just under the +0.02 clear-win threshold, and the change adds real code complexity (tracks previous-period holdings, isn't simpler). MaxDD and avg_turnover both improved marginally (-0.2930->-0.2850, 1.7185->1.6418) but not enough to justify keeping non-simpler code for a sub-threshold Sharpe gain. Consistent conclusion across all three attempts now, at three very different points in this project's config history - turnover hysteresis appears to be a genuinely closed line of inquiry for this basket size, not something that just hadn't been tried against the right baseline yet.
55	-	1.4792	0.6153	-0.2847	discard	tried model_reg_alpha=1.0 (L1 regularization) on top of iteration 53's depth=7 baseline, aiming to narrow that keep's research-vs-holdout gap (flagged as a caution, not yet a problem) without giving up its Sharpe gain. Backfired badly: Sharpe 2.1347->1.4792, a big drop, not a gentle correction. XGBoost's default reg_alpha=0/reg_lambda=1 was apparently already reasonably tuned for this data - stacking meaningful extra L1 on top of existing subsample=0.8/colsample_bytree=0.8 over-regularized the model rather than complementing it. Reverted to reg_alpha=0 (default/off).
56	2c965b3	2.2406	1.0507	-0.2854	keep	halved model_learning_rate 0.1->0.05, doubled model_n_estimators 300->600 (classic stochastic-GB pairing: smaller steps + more of them, generally pairs well with row/column subsampling) against the depth=7 baseline (Sharpe 2.1347). Clear win: Sharpe 2.2406 (+0.1059, well above the +0.02 threshold), CAGR 98.5%->105.1%, MaxDD essentially flat (-0.2930->-0.2854). 553s runtime (roughly 2x, as expected from 2x n_estimators) but well within any timeout concern. Checked against the 2024-2026 holdout per the "before trusting a big keep" rule, especially since this stacks on iteration 53's already-flagged-cautious depth=7 baseline: holdout Sharpe 3.1496->3.2398 (+2.9% relative), close to the research window's +5.0% relative gain - a much healthier research/holdout ratio than iteration 53 had (24% vs 6.4%), i.e. this specific change generalizes better than the depth increase did. Kept with normal confidence (not the extra caution flag iteration 53 needed).
57	-	2.4092	0.5684	-0.1429	discard	tried downside-only vol targeting (semi-deviation vs full std, target 0.15, lookback=63) - structurally different from the twice-failed full-vol overlay (iterations 3, 8), specifically designed not to delever during profitable-but-volatile up days. Mechanically compelling on the research window: Sharpe 2.2406->2.4092, CAGR nearly halved (105.1%->56.8%) but MaxDD nearly halved too (-28.5%->-14.3%) and annual_vol dropped sharply (34.8%->19.5%) - a genuine risk-reduction result, not just noise, and by the mechanical rule this clears the keep bar. BUT the holdout check told a different story: holdout Sharpe went from 3.2398 (iteration 56, no vol-target) DOWN to 2.6803 with this change - the opposite direction from the research-window improvement, unlike every other keep this session where holdout at least agreed on direction. This is exactly the pattern the harness's own rule warns about ("if holdout diverges sharply in either direction... lean toward the simpler/more conservative config") and exactly the kind of research-window-only illusion the whole holdout mechanism exists to catch post-iteration-47. Plausible explanation: 2024-2026 was already established as a much stronger bull market (buy&hold Sharpe 1.34 vs research's 0.59) with presumably fewer/smaller real drawdown events - an overlay that pays for crash insurance by dimming exposure on volatile-but-still-up days costs more than it saves when the holdout period has less real crash risk to insure against. Discarded specifically because of this divergence, not because the research-window number was bad - a clean demonstration of the new methodology doing its job.
58	a0cdf55	2.2406	1.0507	-0.2854	keep	added retrain_freq config knob (default None) decoupling model retrain cadence from rebalance cadence in backtest.py - when None (unset), behavior is mathematically identical to before (verified: benchmark.py reproduces iteration 56's exact Sharpe/CAGR/MaxDD 2.2406/1.0507/-0.2854 bit-for-bit). This is infrastructure, not a direct alpha experiment - it exists to let the frequency direction test rebalancing more often than weekly WITHOUT retraining XGBoost fresh every period (the root mechanical cause of iteration 39's ~90min daily-rebalance runtime blowup). Runtime 686.9s vs iteration 56's 553s (some variance, still well under the 3x/1650s crash threshold). Kept despite adding a new knob because it is strictly backward-compatible (default preserves old behavior exactly) and unlocks the user-requested higher-frequency exploration safely.
59	-	-2.0055	-1.0000	-1.0003	discard	tested rebalance_freq=3D (~twice weekly, 597 periods over 2018-2023) with retrain_freq=M (monthly retrain via iteration 58's new decoupling, so XGBoost was NOT retrained every period - only the predicted ranking/weights were refreshed each 3-day period from the monthly-trained model) against the weekly/every-period-retrain baseline (Sharpe 2.2406). Catastrophic discard: Sharpe -2.0055, CAGR -100%, capital wiped out (max_drawdown -1.0003), worse even than iteration 39's daily-rebalance failure (-0.48). Runtime was fine (618.5s, no crash) so decoupling retrain from rebalance did solve the mechanical runtime-blowup problem, but did NOT solve the underlying economics: at ~100 periods/year (vs weekly's ~43-52), the flat EUR1/trade fee on a EUR10k account still compounds destructively, and re-selecting top_n=5 from a monthly-stale model's predictions every 3 days on fresh short-horizon (label_horizon_days=10) noise adds turnover without adding real signal - the model's 10-day-forward prediction does not meaningfully change on a 3-day view, so each extra rebalance mostly just pays fees to chase sampling noise in the inverse-vol weights and intervening price moves. Confirms iteration 39's finding generalizes: the bottleneck is NOT retrain cost (now decoupled and cheap) but the combination of (a) flat per-trade fees at this account size and (b) a label horizon that is far shorter than the rebalance interval would need for fresh signal. Any future higher-than-weekly attempt would need to also address the cost model (bigger account/pure-bps fees) or make the label horizon independent of rebalance cadence (e.g. keep predicting 10-day returns but only actually trade when the predicted ranking changes materially, i.e. hysteresis) - not tried here, three hysteresis attempts already failed at weekly cadence (iterations 13, 19, 54) but were never tested as a mechanism to suppress noise-driven trades specifically at a higher rebalance frequency, which is a different context.
60	-	-999.0	-	-	crash	tried rebalance_freq=3D + retrain_freq=M + top_n=10 (widened basket to dilute noise-driven turnover, per the smarter-frequency suggestion, after iteration 59's plain 3D/M attempt at top_n=5 wiped out capital) - killed after running far past the normal baseline runtime with no output, consistent with iteration 39's original finding that this walk-forward architecture does not scale cleanly to rebalance frequencies faster than weekly (even with iteration 58's retrain-decoupling, feature engineering/universe selection/turnover bookkeeping still run once per rebalance period, and at ~100 periods/year across a wider top_n=10 basket that per-period overhead compounds). Logged as crash per the timeout-as-crash protocol rule; rolled back. CONCLUSION for the higher-frequency direction this session: three variants tried (iteration 39 historically: naive daily rebalance+retrain, catastrophic Sharpe -0.48; iteration 59: 3D rebalance decoupled from monthly retrain at top_n=5, catastrophic Sharpe -2.0055, capital wiped out; iteration 60: same decoupled setup with top_n widened to 10, crash/impractical runtime) - this axis is now considered mechanically blocked for this account size/cost model/backtest architecture without a larger, separate engineering effort (e.g. vectorizing the per-period loop, or moving to a pure-bps/larger-account cost model), not a one-iteration-sized fix. Pivoting remaining iterations to the model and alternative-strategy directions, where more room for productive experiments remains.
61	-	2.0086	0.8423	-0.2834	discard	wired model_min_child_weight/model_gamma into XGBRegressor (previously not exposed as config knobs at all, an untried regularization axis per the backlog) and tested min_child_weight=5 (vs XGBoost's implicit default of 1) against the current baseline (Sharpe 2.2406) - worse (2.0086), CAGR also dropped notably (105.1%->84.2%). Requiring each leaf to aggregate more Hessian weight before splitting apparently prunes away real signal this model was using, not just noise - over-regularizes similar in spirit to iteration 55's reg_alpha=1.0 backfire. Rolled back the whole commit (git reset --hard HEAD~1), so min_child_weight/gamma are no longer wired into backtest.py at all for now - a future iteration re-adding them should try a smaller bump (e.g. 2-3) or gamma alone instead of jumping straight to 5.
62	-	2.0993	0.8932	-0.2578	discard	finer min_child_weight sweep (2, vs implicit default 1 and iteration 61's failed 5) against baseline (Sharpe 2.2406) - still worse (2.0993), though less bad than 5's 2.0086 and MaxDD did improve (-0.2854->-0.2578). Monotonic degradation as min_child_weight increases from 1 (implicit baseline, best) -> 2 -> 5 confirms XGBoost's default of 1 is already well-suited here; this axis is now closed (no further values worth trying, the direction is clearly wrong). Reverted (full commit rollback, min_child_weight no longer wired).
64	-	2.2406	1.0507	-0.2854	discard-holdout	holdout-driven rollback of iteration 63 (elevated-only downside-vol overlay). Per the "before trusting a big keep" rule, ran holdout_check.py on it: research window improved (Sharpe 2.2406->2.5886, +15.5% relative) but the 2024-2026 holdout went the OPPOSITE direction (3.2398->3.0163, -6.9% relative) - the same direction-disagreement red flag that sank iteration 57's always-on version, just milder in magnitude. The elevated-only gating (only de-risk when downside vol exceeds its own trailing-252d 80th percentile) reduced but did not eliminate the bull-market tax problem: 2024-2026 is still establishyed as the stronger bull market (buy&hold Sharpe 1.34 vs research's 0.59), and apparently still has enough qualifying "elevated downside vol" trigger events (even if fewer than the always-on version) that de-risking through them costs more than it saves. Per the harness's own rule ("holdout diverges in either direction -> lean toward the simpler/more conservative config"), rolled back to iteration 58/62's plain config (vol_target=None, no overlay at all) rather than keep a mechanism that has now twice shown this exact failure pattern (direction flip vs a stronger-bull holdout) across two different implementations. metric/cagr/max_drawdown columns here are the reverted config's already-established numbers (2.2406/1.0507/-0.2854, identical to iteration 58), not a fresh benchmark.py run. CONCLUSION for vol-targeting as a whole: three structurally different implementations tried across this project's history (full-vol always-on x2, downside-only always-on, downside-only elevated-gated) - all four variants either hurt the research window outright or showed a research/holdout direction split. This line of inquiry is now considered closed for this universe/cost-model/period unless a future attempt uses a fundamentally different trigger (e.g. a real market-wide stress indicator rather than any variant of the basket's own trailing realized vol).
65	-	1.7527	0.7300	-0.3138	discard	fine-tuned model_subsample 0.8->0.6 (more aggressive row subsampling, same stochastic-GB theme as the iteration 56/51 keeps) against baseline (Sharpe 2.2406) - notably worse (1.7527), MaxDD also deepened (-28.5%->-31.4%). 0.8 is already a well-tuned value on this axis; pushing subsampling more aggressive starts throwing away real signal (each tree sees too small a row sample to learn reliably at this basket/feature size) rather than adding useful variance-reduction. Reverted to 0.8.
66	07273e8	2.4014	1.0470	-0.1863	keep	added greedy correlation cap (model_corr_cap=0.7) during top-N selection in both backtest.py and paper_trading/engine.py: after ranking candidates by predicted return, greedily accept a candidate only if its trailing-return correlation (same 126d point-in-time window used for inverse_vol/HRP weighting) to every already-accepted name is <=0.7, else skip and try the next-ranked name (relax-and-backfill if the ranked list runs out before filling top_n); addresses the diagnosed root cause of the live forward-test bleed (top-5 repeatedly concentrating in correlated semiconductor/memory names during a volatile sub-sector swing) by changing WHICH names get picked, distinct from HRP/inverse_vol which only reweight an already-fixed basket. Clear win vs baseline (Sharpe 2.2406->2.4014, CAGR roughly flat 1.0507->1.0470, MaxDD markedly better -0.2854->-0.1863). Diagnostic-only side check (not part of repo, scratch script replicating the walk-forward loop) confirms the mechanism is doing what it is meant to: avg pairwise correlation within the selected basket dropped 0.3007->0.2649 and the consecutive-period ticker repeat rate dropped 0.1876->0.1714 across the same 260 periods. Runtime 523s, within normal range (not meaningfully slower than the ~550-700s baseline).
-	-	-	-	-	holdout-check	holdout_check.py on iteration 66's kept config (model_corr_cap=0.7), per the "before trusting a big keep" convention - informational only, per this run's explicit instructions this does NOT change the keep/discard decision. Research window improved (Sharpe 2.2406->2.4014, +7.2% relative) but the 2024-2026 holdout went the OPPOSITE direction (3.2398->2.7887, -13.9% relative), the same direction-disagreement pattern that drove iterations 57 and 64's holdout-triggered rollbacks of vol-targeting variants. Plausible explanation: the correlation cap forces diversification away from whatever correlated cluster the unconstrained top-5 would otherwise pick; in the 2018-2023 research window that cluster apparently included some of the model's worst drawdown contributors (MaxDD improved sharply -0.2854->-0.1863, consistent with this), while in the stronger-bull 2024-2026 holdout (buy&hold Sharpe 1.34 vs research 0.59) the names the cap excludes were apparently net contributors more often than detractors, so forcing diversification away from them cost more than it saved. Flagged prominently for the user: this keep carries the same holdout-divergence caution flag as the two vol-targeting discards, but is being kept per this run's explicit instruction (not the harness's usual rollback-on-divergence convention) because the live forward-test evidence motivating this whole hypothesis (concentrated correlated-sector crash risk) is itself an out-of-sample-style argument the research window alone cannot fully adjudicate.
67	a0b5453	2.4743	0.8261	-0.2139	keep	follow-up on iteration 66's correlation-cap keep: stricter threshold 0.7->0.5 (same greedy-selection mechanism, no other change) against the new sharpe_prev_kept=2.4014. Clear win: Sharpe 2.4014->2.4743 (+0.0729, above the +0.02 threshold). CAGR dropped more than 0.7's variant did (1.0470->0.8261) and annual_vol fell sharply (0.3206->0.2580) - a stricter cap forces the basket further from its unconstrained top-5 picks, trading some return for materially lower volatility. MaxDD -0.2139, between the 0.7 variant's -0.1863 and the pre-cap baseline's -0.2854 (not monotonic with threshold, i.e. 0.7 happened to land on a better MaxDD than 0.5 despite 0.5 being the stricter/more-diversifying setting - plausibly because 0.5's forced substitutions occasionally picked up a name that itself had a bad drawdown period the 0.7 variant's milder filtering avoided). Runtime 522.7s, same ballpark as 0.7's 523.1s (as expected - most of the extra cost is the O(n^2) correlation matrix over the full ranked universe, not materially sensitive to the threshold value itself).
-	-	-	-	-	holdout-check	holdout_check.py on iteration 67's kept config (model_corr_cap=0.5), informational only per this run's instructions. Unlike iteration 66's 0.7 variant (which diverged from the research-window direction), this one AGREES in direction on both windows: research Sharpe 2.4014->2.4743 (+3.0%) and holdout Sharpe 3.2398->3.3474 (+3.3%), a healthy, proportionate pair of improvements, plus holdout MaxDD improved too (-0.1892, best of any correlation-cap variant checked so far on either window). Taken together with iteration 66's holdout divergence, this suggests the stricter 0.5 threshold is forcing enough genuine diversification to help in both the research window's weaker bull market and the holdout's stronger one, whereas 0.7's milder filtering apparently still let enough of the correlated cluster back in to behave inconsistently across regimes. 0.5 is currently the more trustworthy of the two correlation-cap operating points tried, by this cross-window-agreement standard (still informational, not a decision input, per this run's explicit rule).
68	-	2.2516	1.0337	-0.2809	discard	tried a looser correlation cap threshold 0.85 (vs the 0.5 baseline, Sharpe 2.4743) to complete the 3-point sweep (0.5/0.7/0.85) requested for this hypothesis family. Worse: Sharpe 2.2516 (-0.2227), MaxDD back up to -0.2809, essentially indistinguishable from the pre-cap baseline's -0.2854 - at 0.85 the filter apparently almost never triggers (most correlated-cluster pairs in this universe fall well under 0.85 pairwise correlation even within the same sub-sector), so it behaves close to no cap at all while still paying the extra O(n^2) correlation-matrix compute cost for no benefit. Reverted (git reset --hard HEAD~1). CONCLUSION for this threshold sweep: 0.5 (Sharpe 2.4743, holdout direction-agreeing) > 0.7 (Sharpe 2.4014, holdout direction-diverging) > 0.85 (Sharpe 2.2516, ~no-op) > no cap (Sharpe 2.2406) - monotonically worse as the threshold loosens toward 'no cap', consistent with the mechanism doing real work only when it is strict enough to actually bind. Current best/kept config is model_corr_cap=0.5 from iteration 67. Stopping this hypothesis family here (3 experiment iterations run: 0.7, 0.5, 0.85 - at the cap suggested for this run).
